Reference,Post Title,URL
SE1,Integration Testing best practices,http://www.stackoverflow.com/questions/1328730
SE2,"TDD: ""Test Only"" Methods",http://www.stackoverflow.com/questions/2295965
SE3,Good approach/Strategy to keep integration test database in-sync with production db?,https://softwareengineering.stackexchange.com/questions/302458
SE4,Managing database connections for unit tests,https://codereview.stackexchange.com/questions/201711
SE5,Unit-Tests and databases: At which point do I actually connect to the database?,https://softwareengineering.stackexchange.com/questions/206539
SE6,"In JUnit 5, how to run code before all tests",http://www.stackoverflow.com/questions/43282798
SE7,Spring integration tests with profile,http://www.stackoverflow.com/questions/20551681
SE8,Different db for testing in Django?,http://www.stackoverflow.com/questions/4650509
SE9,How to run Django tests on Heroku,http://www.stackoverflow.com/questions/13705328
SE10,Django test to use existing database,http://www.stackoverflow.com/questions/6250353
SE11,How to suppress InMemoryEventId.TransactionIgnoredWarning when unit testing with in-memory database with transactions?,http://www.stackoverflow.com/questions/44080733
SE12,In-memory MongoDB for test?,http://www.stackoverflow.com/questions/13607732
SE13,Should mock objects for tests be created at a high or low level,https://softwareengineering.stackexchange.com/questions/216072
SE14,What's the idea behind mocking data access in unit tests,https://softwareengineering.stackexchange.com/questions/262686
SE15,Ways of unit testing data access layer,http://www.stackoverflow.com/questions/15000908
SE16,How to Mock Test Data for complicated Integration/GUI automated tests,https://softwareengineering.stackexchange.com/questions/405456
SE17,How to throw a SqlException when needed for mocking and unit testing?,http://www.stackoverflow.com/questions/1386962
SE18,How to write unit tests without mocking data,https://softwareengineering.stackexchange.com/questions/193614
SE19,Unit testing Systems with Logic Tightly Coupled with Data,https://softwareengineering.stackexchange.com/questions/356087
SE20,Rethinking testing strategy,https://softwareengineering.stackexchange.com/questions/212887
SE21,How to turn off parallel execution of tests for multi-project builds?,http://www.stackoverflow.com/questions/11899723
SE22,Unit testing Room and LiveData,http://www.stackoverflow.com/questions/44270688
SE23,How to run tests in parallel in Django?,http://www.stackoverflow.com/questions/5303819
SE24,What's the best strategy for unit-testing database-driven applications?,http://www.stackoverflow.com/questions/145131
SE25,How do you handle testing applications that are heavily dependent on databases?,http://www.stackoverflow.com/questions/2393428
SE26,Integration Testing best practices,http://www.stackoverflow.com/questions/1328730
SE27,Rails 3.0.7 -> How do you get your tests to run faster?,http://www.stackoverflow.com/questions/6087329
SE28,"How can I automatically test my site for SQL injection attacks, using either a script or program?",http://www.stackoverflow.com/questions/9685884
SE29,Django: is there a way to count SQL queries from an unit test?,http://www.stackoverflow.com/questions/1254170
SE30,Do you test your SQL/HQL/Criteria?,https://softwareengineering.stackexchange.com/questions/33182
SE31,How do I test database migrations?,http://www.stackoverflow.com/questions/2332400
SE32,How to show SQL query log generated by a RSpec test?,http://www.stackoverflow.com/questions/6884408
SE33,SQL queries in integration tests,https://softwareengineering.stackexchange.com/questions/326003
SE34,Integrating Automated Web Testing Into Build Process,http://www.stackoverflow.com/questions/1240057
SE35,What is a good method of storing test data for development and unit testing with angularjs and jasmine?,https://softwareengineering.stackexchange.com/questions/238971
SE36,"Do the terms ""unit test"" and ""integration test"" sometimes overlap or conflict?",https://softwareengineering.stackexchange.com/questions/302559
SE37,Databases and Unit/Integration Testing,https://softwareengineering.stackexchange.com/questions/101273
SE38,How do you unit test business applications?,http://www.stackoverflow.com/questions/38598
SE39,Unit Test vs Integration Test in Web Development,http://www.stackoverflow.com/questions/15292751
SE40,What's the best strategy for unit-testing database-driven applications?,http://www.stackoverflow.com/questions/145131
SE41,Should on each test create and nuke a testing database?,https://softwareengineering.stackexchange.com/questions/394145
SE42,Testing - In-Memory DB vs Mocking,https://softwareengineering.stackexchange.com/questions/358491
SE43,Unit testing a service to return items from a database,https://codereview.stackexchange.com/questions/98301
SE44,MySQL - force not to use cache for testing speed of query,http://www.stackoverflow.com/questions/181894
SE45,Shouldn't unit tests use my own methods?,https://softwareengineering.stackexchange.com/questions/330304
SE46,How to test data based on SQL queries?,https://softwareengineering.stackexchange.com/questions/315178
SE47,Testing my VB.NET code?,https://softwareengineering.stackexchange.com/questions/159943
SE48,Should each unit test be able to be run independently of other tests?,https://softwareengineering.stackexchange.com/questions/64306
SE49,Is it bad form to count on the order of your NUnit unit tests,http://www.stackoverflow.com/questions/497699
SE50,My first model test in PHPUnit,https://codereview.stackexchange.com/questions/59662
SE51,How do I unit test a WCF service?,http://www.stackoverflow.com/questions/37375
SE52,unit/integration testing web service proxy client,https://softwareengineering.stackexchange.com/questions/167906
SE53,How to unit test an object with database queries,http://www.stackoverflow.com/questions/30710
SE54,Unit test for a method that adds tweets to a database,https://codereview.stackexchange.com/questions/128287
SE55,Unit/Integration Testing my DAL,https://softwareengineering.stackexchange.com/questions/133448
SE56,Is Unit Testing your SQL taking TDD Too far?,http://www.stackoverflow.com/questions/730488
SE57,Am I Unit Testing or Integration Testing my Stored Procedures?,https://softwareengineering.stackexchange.com/questions/81801
SE58,How to test the data access layer?,https://softwareengineering.stackexchange.com/questions/219362
SE59,Is a class that is hard to unit test badly designed?,http://www.stackoverflow.com/questions/2658859
SE60,"Basic Unit Test of Application Service, setup and cleanup methods",https://codereview.stackexchange.com/questions/234960
SE61,How to create unit/integration tests for my web app?,https://softwareengineering.stackexchange.com/questions/214529
SE62,SQLite Database inserting + Unit tests in Java,https://codereview.stackexchange.com/questions/132742
SE63,Unit Testing - What not to test,http://www.stackoverflow.com/questions/1316848
SE64,Unit Testing - What not to test,http://www.stackoverflow.com/questions/1316848
SE65,"How are people unit testing with Entity Framework 6, should you bother?",http://www.stackoverflow.com/questions/22690877
SE66,How do I unit test a WCF service?,http://www.stackoverflow.com/questions/37375
SE67,Should I Unit Test Data Access Layer? Is this a good practice and how to do it?,http://www.stackoverflow.com/questions/3333120
SE68,How to add rigor to my testing?,https://softwareengineering.stackexchange.com/questions/270422
SE69,How to write unit tests for database calls,http://www.stackoverflow.com/questions/1217736
SE70,What kind of unit tests should be written for a call to a database update function?,https://softwareengineering.stackexchange.com/questions/336880
SE71,Unit testing with MongoDB,http://www.stackoverflow.com/questions/7413985
SE72,Beginning Automated Testing,http://www.stackoverflow.com/questions/12907080
SE73,Does TDD include integration tests?,http://www.stackoverflow.com/questions/18988040
SE74,Do we need test data or can we rely on unit tests and manual testing?,https://softwareengineering.stackexchange.com/questions/113441
SE75,"Never written much unit tests, how can I practice more of it?",https://softwareengineering.stackexchange.com/questions/128859
SE76,"Removing the ""integration test scam"" - Understanding collaboration and contract tests",https://softwareengineering.stackexchange.com/questions/135011
SE77,How to test the data access layer?,https://softwareengineering.stackexchange.com/questions/219362
SE78,How to do database unit testing?,http://www.stackoverflow.com/questions/3772093
SE79,Should you hard code your data across all unit tests?,https://softwareengineering.stackexchange.com/questions/212678
SE80,Phpunit testing with database,http://www.stackoverflow.com/questions/4585345
SE81,How to simulate a DB for testing (Java)?,http://www.stackoverflow.com/questions/928760
SE82,Creating many random test database entries,https://codereview.stackexchange.com/questions/14411
SE83,Why do we write mock objects when writing unit test cases?,https://softwareengineering.stackexchange.com/questions/61366
SE84,How to test DAO methods using Mockito?,http://www.stackoverflow.com/questions/28388204
SE85,How to create unit/integration tests for my web app?,https://softwareengineering.stackexchange.com/questions/214529
SE86,Testing properties with private setters,https://softwareengineering.stackexchange.com/questions/317121
SE87,Unit Testing with massive lookup tables?,https://softwareengineering.stackexchange.com/questions/287735
SE88,Where is the line between unit testing application logic and distrusting language constructs?,https://softwareengineering.stackexchange.com/questions/322909
SE89,How do I unit test jdbc code in java?,http://www.stackoverflow.com/questions/266370
SE90,How to Test Web Code?,http://www.stackoverflow.com/questions/2913
SE91,Unit testing database application with business logic performed in the UI,http://www.stackoverflow.com/questions/2609204
SE92,Best practices for database testing with PHPUnit,http://www.stackoverflow.com/questions/3697815
SE93,Unit-testing an adapter,https://codereview.stackexchange.com/questions/38906
SE94,How to test Spring Data repositories?,http://www.stackoverflow.com/questions/23435937
SE95,Is this good practice with unit-testing?,https://codereview.stackexchange.com/questions/37584
SE96,Laravel 5 : Use different database for testing and local,http://www.stackoverflow.com/questions/35227226
SE97,JUnit tests always rollback the transactions,http://www.stackoverflow.com/questions/9817388
SE98,Initialising a database before Spring Boot test,http://www.stackoverflow.com/questions/38262430
SE99,How can I specify a database for Django Tests to use instead of having it build it every time?,http://www.stackoverflow.com/questions/4606756
SE100,How to create table during Django tests with managed = False,http://www.stackoverflow.com/questions/7020966
SE101,"Do you have any SQL Injection Testing ""Ammo""?",http://www.stackoverflow.com/questions/274659
SE102,Testing for security vulnerabilities in web applications: Best practices?,http://www.stackoverflow.com/questions/2351315
SE103,Best way to test SQL queries,http://www.stackoverflow.com/questions/754527
SE104,How do you unit test your T-SQL,http://www.stackoverflow.com/questions/2765212
