,title,url,answers,tags,highlights
0,Acceptance test execution strategies for heavy first-time-setup apps,https://softwareengineering.stackexchange.com/questions/335985,['https://softwareengineering.stackexchange.com/a/335993'],"['DB Management > Cleanup > Cleanup before each test (known state)', 'DB Management > Preparation > Seeding the minimum needed for the concerned test']","['{0:Consider only seeding the absolute minimum that the particular test case requires to run.}', '{1:setting up the state before each test}']"
1,Accessing localStorage in Protractor test for AngularJS application,http://www.stackoverflow.com/questions/21960598,['https://stackoverflow.com/a/28616326'],"['Test Code > API > Use specific API', 'Test Code > Code example > Code example provided']",[None]
2,Am I just not understanding TDD unit testing (Asp.Net MVC project)?,http://www.stackoverflow.com/questions/2867798,"['https://stackoverflow.com/a/2867834', 'https://stackoverflow.com/a/2873534', 'https://stackoverflow.com/a/3388232']","['Concepts > Coverage > 100% coverage is not possible', 'DB Management > Cleanup > Cleanup before each test (known state)', 'Environment > Configuration > General recommendation > Recommend specific library/configuration', 'Environment > Tool > Unit Testing > Use DbUnit', 'Mocking > When > Use Mocking', 'Structure/Design > Testability > Design with single responsibility']","['{0:As far as database testing is concerned it is no longer unit tests but integration tests.}', '{1:. The idea is that before every test is run, it puts the database in a known state. And it does this automatically in the setup/teardown of your tests.}', '{2:Testing is not about 100% coverage. }', '{3:. Just try to design your application in such a way that each class has a single responsibility}']"
3,Am I Unit Testing or Integration Testing my Stored Procedures?,https://softwareengineering.stackexchange.com/questions/81801,"['https://softwareengineering.stackexchange.com/a/81812', 'https://softwareengineering.stackexchange.com/a/81819', 'https://softwareengineering.stackexchange.com/a/81830']","['Characteristics > Deterministic > Minimise moving parts to avoid non-deterministic tests', 'DB Management > Cleanup > Populate once, and rollback changes before each test', 'DB Management > Cleanup > Populate once and use MERGE statement to remove/insert/update unwanted data', 'DB Management > Test DB > Use local DB so the DB environment does not affect the tests', 'Environment > Tool > Unit Testing > Use SSDT (SQL Server Data Tools) unit tests', 'Structure/Design > Testability > Break the procedures (db/code) down to smaller parts']","['{0:My solution was to evolve a framwork that executes the stored procedures inside a transaction, after initializing the database to the initial conditions I needed, then testing for the expected result, also within the same transaction. The transaction was rolled back at the end of the test.}', '{1:On my current project, I have begun using SSDT unit tests}', '{2:These typically deploy the database project to your instance of SQL Server LocalDB, so this removes any question about the database environment affecting the test.}', ""{3:I use MERGE statements to do this, ensuring that any data I don't need for the current test is removed, inserted or updated from the database before the test.}"", '{4:If you feel the procedures are too complex, you may well want to break them themselves into smaller parts}', '{5:The more moving parts you have the higher the risk of having a non-deterministic test.}']"
4,Android Unit Tests Requiring Context,http://www.stackoverflow.com/questions/2095695,"['https://stackoverflow.com/a/2095761', 'https://stackoverflow.com/a/37351386', 'https://stackoverflow.com/a/56514421']","['Concepts > Definitions > Explanation of levels of tests: unit, interaction, integration and acceptance tests', 'Test Code > API > Android > Use AndroidTestCase', 'Test Code > API > InstrumentationRegistry']","['{0:use InstrumentationRegistry metho}', '{1: to AndroidTestCase. }', '{2:Your test is not a Unit test!!!}', '{3:not writing a unit test.}']"
5,Are DDD aggregates a good boundary for unit testing?,https://softwareengineering.stackexchange.com/questions/311832,"['https://softwareengineering.stackexchange.com/a/311840', 'https://softwareengineering.stackexchange.com/a/312164']",['DB Management > Test DB > Use a test database with test data'],"['{0:Tests are executable specification.}', '{1:Either use the existing, public interface, reusing your aggregates for the test data, or you can create an artifical interface just for testing purposes, which duplicates the whole data of your aggregates}']"
6,Are HSQLDB unit tests an anti pattern?,https://softwareengineering.stackexchange.com/questions/228531,"['https://softwareengineering.stackexchange.com/a/229257', 'https://softwareengineering.stackexchange.com/a/229265', 'https://softwareengineering.stackexchange.com/a/229920']","['Concepts > Definitions > Explanation of levels of tests: unit, interaction, integration and acceptance tests', 'Environment > In-Memory DB > Generic recommendation > Use in memory database', 'Mocking > When > Mocking the DB is bad practice, use integration/acceptance test', 'Structure/Design > Coupling > With DB > Inversion of control', 'Structure/Design > Design Patterns > Use dependency injection']","['{0: a proper unit-test for your DAO would be developed by passing to it a concrete mocked implementation }', '{1:Mocking the DB is a bad practice}', '{2:If a test requires DB, it is not the unit test. It is either integration or acceptance test.}', '{3:But you could also develop and test it against an in-memory database with less overhead}']"
7,Are there any security test plugins for rails?,http://www.stackoverflow.com/questions/757318,"['https://stackoverflow.com/a/760616', 'https://stackoverflow.com/a/775987', 'https://stackoverflow.com/a/776033']",['Environment > Tool > Vulnerability Testing > Vulnerability Testing'],[None]
8,At which architecture level are you running BDD tests (e.g. Cucumber),https://softwareengineering.stackexchange.com/questions/38966,"['https://softwareengineering.stackexchange.com/a/177613', 'https://softwareengineering.stackexchange.com/a/39201']","['Concepts > Definitions > Testing Triangle', 'Process > Testing > Manual UI Testing']","['{0:the testing triangle in m}', '{1:UI testing as manual}', '{2:unit tests}']"
9,Azure: Best Practice for Testing in a Staging Environment with Code First Migrations,http://www.stackoverflow.com/questions/11319577,"['https://stackoverflow.com/a/11320870', 'https://stackoverflow.com/a/32799674']",['IRRELEVANT ANSWER'],[None]
10,"Basic Unit Test of Application Service, setup and cleanup methods",https://codereview.stackexchange.com/questions/234960,['https://codereview.stackexchange.com/a/234967'],"['Concepts > Scope > Test it > Test data as well and not just counts', 'Structure/Design > Design Patterns > Use template interfaces for all repositories, so the mock implements that interface']","['{0:What I mean is if you had a template interface for all repositories, maybe you might need just one template implementation of the fake.}', '{1: I suggest you also test the items data, not just their count, because picking the data from command and passing them to the repository is responsibility of the service and thus should be subject of this test.}']"
11,Beginning Automated Testing,http://www.stackoverflow.com/questions/12907080,"['https://stackoverflow.com/a/12907368', 'https://stackoverflow.com/a/12907393']","['Concepts > Coverage > Cover all corners', 'Concepts > Definitions > Explanation of levels of tests: unit, interaction, integration and acceptance tests', 'Concepts > Scope > Test it > Localization', 'Concepts > Scope > Test it > Performance', 'Concepts > Scope > Test it > Regular input', 'Concepts > Scope > Test it > Stress test', 'Concepts > Scope > Test it > UI', 'Environment > Tool > Unit Testing > Use a unit test framework', 'Environment > Use Real DB > SQLite > Faster tests > Use SQLite for integration tests']","['{0:purpose of automated testing}', '{10:localization}', '{11:UI,}', '{12:There should be a few tests for the normal cases and a few more for the border cases.}', '{13:I think you can use some file system based db like SQLite3.}', '{1:The purpose is }', '{2:describe the methods of testin}', '{3:unit testing}', '{4:write unit tests}', '{5:libraries out there that can be used for uni}', '{6:stress}', '{7:performance}', '{8:border cases}', '{9:regular input}']"
12,Best practices for database testing with PHPUnit,http://www.stackoverflow.com/questions/3697815,"['https://stackoverflow.com/a/3817970', 'https://stackoverflow.com/a/3955075']","['Concepts > Scope > Test it > Add test to verify charsets', 'DB Management > Cleanup > Load the database at the start of the suite, clear rows and reload data for tables that have changed before each test', 'DB Management > Preparation > setUp() & tearDown() methods', 'DB Management > Preparation > Use test fixtures', 'Environment > Tool > Unit Testing > Zend PHPUnit DB plug-in', 'Process > Test Failure Identification / Debugging > Log failing / slow queries', 'Test Code > Assertions > Compare LINQ query results with DB query results', 'Test Code > Assertions > Select rows from the DB to assert changes were done correctly']","[""{0:I load my MySQL dump at the start of the first suite which contains any of the information I'm assuming to be true across all tests. When each test starts I use a setupDatabase method. This method deletes all the rows from the tables I know have changed then it loads a flat XML dataset containing the data I need to hold true.}"", '{1:I use a collection of simple methods to select rows from the database to assert the changes I made were done correctly.}', '{2:The Zend Framework has an interesting library for PHPUnit that allows tests to compare a database table to a flat XML dataset}', ""{3:It's good to have fixtures (with or without db structure), loaded into db in startUp() of every test.}"", '{4:Adding assertion to compare directly LINQ query result with db query result makes creating tests pure pleasure}', '{5:db should be reinitialised before every testing method}', '{6:mock up database access singleton}', ""{7:Good idea is to log all queries which didn't passed test}"", '{8:try to log slow queries at the same time}', '{9:always add tests for veryfing charsets}']"
13,Best way to create a test database and load fixtures on Symfony 2 WebTestCase?,http://www.stackoverflow.com/questions/14752930,"['https://stackoverflow.com/a/14754514', 'https://stackoverflow.com/a/19382149', 'https://stackoverflow.com/a/22132585']",['Environment > Configuration > General recommendation > Configuration recommendation'],[None]
14,Best way to test SQL queries,http://www.stackoverflow.com/questions/754527,"['https://stackoverflow.com/a/754540', 'https://stackoverflow.com/a/754570', 'https://stackoverflow.com/a/754596']","['DB Management > Test DB > Use a test database with test data', 'Environment > Tool > Unit Testing > Use DbUnit', 'Structure/Design > Testability > Decompose your queries', 'Test Code > Code example > Code example provided']","['{0:Decompose your queries}', '{1:Create a test system database}', '{2:You might want to check DbUnit,}']"
15,CakePHP unit test not recognizing fixtures,http://www.stackoverflow.com/questions/39400558,['https://stackoverflow.com/a/40857193'],"['Environment > Configuration > App Framework > PHPCake > Parameter for query logging', 'Environment > Configuration > Testing Framework > PHPUnit > Parameter for fixture debugging']",[None]
16,Capybara+Selemium: How to initialize database in an integration test code and make it visible in Rails application?,http://www.stackoverflow.com/questions/5433690,['https://stackoverflow.com/a/5435732'],"['Environment > Configuration > Testing Framework > Capybara > Framework/Tool Usage > Capybara configuration', 'Environment > Tool > Acceptance Test > Combine Capybara with Selenium', 'Test Code > Code correction > Code correction']",[None]
17,Cleaning out test database before running tests,http://www.stackoverflow.com/questions/16319463,"['https://stackoverflow.com/a/16319750', 'https://stackoverflow.com/a/16321613']","['DB Management > Cleanup > Cleanup before each test (known state)', 'Test Code > Code example > Code example provided']",[None]
18,Cleaning up a database in django before every test method,http://www.stackoverflow.com/questions/434700,"['https://stackoverflow.com/a/435087', 'https://stackoverflow.com/a/436795', 'https://stackoverflow.com/a/4438518']","['DB Management > Preparation > setUp() & tearDown() methods', 'Test Code > API > Use specific API']","['{0:By default when Django runs against sqlite backend it creates a new in memory database for a test. That means for every class that derives from unittest.TestCase, I get a new database.}', '{1:use django.test.TestCase not unittest.TestCase. }']"
19,Clearing the test database between unit and functional tests in Rails (factory_girl),http://www.stackoverflow.com/questions/1189266,"['https://stackoverflow.com/a/1189355', 'https://stackoverflow.com/a/1191665', 'https://stackoverflow.com/a/15466214']",['Environment > Configuration > DB > Specific database configuration recommendation'],[None]
20,Configure Jest global tests setup with .ts file (TypeScript),http://www.stackoverflow.com/questions/48318230,['https://stackoverflow.com/a/48376661'],"['Environment > Configuration > DB > Specific database configuration recommendation', 'IRRELEVANT ANSWER']",[None]
21,Configure specific in memory database for testing purpose in Spring,http://www.stackoverflow.com/questions/32001391,"['https://stackoverflow.com/a/32001488', 'https://stackoverflow.com/a/32003729', 'https://stackoverflow.com/a/40190079']","['Environment > Configuration > DB > Specific database configuration recommendation', 'Environment > In-Memory DB > Generic recommendation > Use in memory database', 'Test Code > Code example > Code example provided']",[None]
22,"Confusion between E2E testing, Unit testing and mocking data with $httpBackend",http://www.stackoverflow.com/questions/13197272,"['https://stackoverflow.com/a/13313407', 'https://stackoverflow.com/a/39270077']","['Characteristics > Atomic > Test should focus on one thing', 'Characteristics > Isolated/Independent > Assume that the external component works fine', ""Concepts > Scope > Don't test it > Don't test it if there is no logic there"", 'Concepts > Scope > Test it > Test front end and back end separately', 'Mocking > When > Use Mocking', 'Test Code > API > Use specific API']","[""{0:For any database-centric application, complete integration testing (i.e. with a live server, connected to a database loaded with data) would be particularly messy because there would have to be a process that generates sufficient data for all tests and resets the DB and tests would have to be careful not to modify each other's data.}"", ""{10:You are right that it's messy to test against a live database}"", '{11:you should use $httpBackend to mock out the server.}', '{12:If your service/factory uses the http service to call a remote API you can return fake data from it for unit testing.If you are starting a new Angular project consider using Protractor for E2E tests.}', ""{1:I'm assuming it is best to sever the link between server and client and run the Angular tests using mock data only.}"", '{2:unit testing controllers is redundant as their values are bound to the model}', '{3:Unit testing would only be helpful in very complex controllers or to test services and directives.}', ""{4:this poses the aforementioned problem of creating test data for all scenarios and you'd probably need to reset the in-memory DB before each test to be sure the tests are not affected.}"", ""{5:there's no particular reason that angular tests and backend tests need to be commingled.}"", '{6: test them separately,}', '{7:assuming that the other component works fine}', '{8:test just the component the unit tests is interested in}', ""{9:Unit tests don't concern themselves with how the UI works, or that the right data is bound correctly, but rather than the business logic of the app is correct.}""]"
23,Connector for Odoo through xmlrpc (with testing code),https://codereview.stackexchange.com/questions/123758,[None],['NO ANSWER'],[None]
24,Convincing my boss that touching the Database is integration testing,https://softwareengineering.stackexchange.com/questions/257434,"['https://softwareengineering.stackexchange.com/a/257439', 'https://softwareengineering.stackexchange.com/a/257502', 'https://softwareengineering.stackexchange.com/a/257508']","['Characteristics > Isolated/Independent > Unit test should be independent / isolated', 'Characteristics > Paralysable > Unit tests should be runnable in parallel', 'Concepts > Definitions > Explanation of levels of tests: unit, interaction, integration and acceptance tests']","['{0:Show the benefits.}', ""{1:Don't get into an argument over the definitions of words}""]"
25,Could not load TestContextBootstrapper - Spring Unit testing,http://www.stackoverflow.com/questions/28013452,"['https://stackoverflow.com/a/28026389', 'https://stackoverflow.com/a/28039465', 'https://stackoverflow.com/a/40981292']",['Environment > Configuration > General recommendation > Upgrade to newer version'],['{0:you are using a old version of base spring (2.5.6)}']
26,Create better Unit test,https://codereview.stackexchange.com/questions/48624,"['https://codereview.stackexchange.com/a/48625', 'https://codereview.stackexchange.com/a/48628']","['Characteristics > Self-explaining > Assumptions on existings records should be obvious', 'Characteristics > Self-explaining > Intuitive test case names', 'Concepts > Coverage > Cover all corners', 'Structure/Design > Testability > Testability']","['{0:they make assumptions that are not exactly obvious}', '{1:Covering all corners}', '{2:test case names could be more intuitive}', '{3:Give your tests names describing what they test!}', '{4:also belong in a @After method rather than being done in every test individually.}']"
27,Create Duplicate SQL Database for Testing,http://www.stackoverflow.com/questions/12704572,"['https://stackoverflow.com/a/12704621', 'https://stackoverflow.com/a/12705025', 'https://stackoverflow.com/a/46105213']","['DB Management > Test DB > Use backed up database to create a test database', 'DB Management > Test DB > Use copy database to create a test database']",[None]
28,Creating many random test database entries,https://codereview.stackexchange.com/questions/14411,"['https://codereview.stackexchange.com/a/14463', 'https://codereview.stackexchange.com/a/176820']","['DB Management > Test data > Generation > Create random but valid data entries', 'Performance > Query optimisation > Speed up insert > Use multi_query API (MySQL)', 'Performance > Query optimisation > Speed up insert > Use prepared statement in loops']","['{0:You could run a million INSERT queries fast if you stick all of them into a single string, and use the multi_query API.}', '{1:even a simple loop might be good enough, if you use prepared statements.}']"
29,DAO Unit testing,http://www.stackoverflow.com/questions/9807414,"['https://stackoverflow.com/a/10012781', 'https://stackoverflow.com/a/14384960', 'https://stackoverflow.com/a/9807665']","['Concepts > Scope > Test it > Test DAO/Repository normally if it performs any logic', 'DB Management > Test DB > Use a Test database and rollback', 'Environment > In-Memory DB > Generic recommendation > Use in memory database', 'Environment > In-Memory DB > HSQLDB > HSQLDB', 'Environment > Tool > Unit Testing > Use DbUnit', 'Mocking > What > Mock the DAO to test the Services', 'Mocking > When > Use Mocking']","['{0:test database}', '{1:running test database}', '{2:rollback the test data }', '{3:DAO worth testing with mocks}', '{4:tabase DBUnit is use}', '{5:an in-memory database like H2 or HSQLDB}', '{6:HSQLDB for DAO testing}', '{7:HSQLDB}', '{8:HSQLDB}', '{9:Once DAOs are tested, definitely mock them to unit test your services.}']"
30,Database data needed in integration tests; created by API calls or using imported data?,http://www.stackoverflow.com/questions/482827,"['https://stackoverflow.com/a/542817', 'https://stackoverflow.com/a/552365', 'https://stackoverflow.com/a/552595']","['DB Management > Cleanup > Cleanup before each test (known state)', 'Environment > Use Real DB > Generic recommendation > Use real database']","['{0:create an empty database}', '{1:run the install script to initialize it,}', '{2:test with real database}', '{3:known state before every test}']"
31,Databases and Unit/Integration Testing,https://softwareengineering.stackexchange.com/questions/101273,"['https://softwareengineering.stackexchange.com/a/101278', 'https://softwareengineering.stackexchange.com/a/101280', 'https://softwareengineering.stackexchange.com/a/101281']","['Concepts > Definitions > Explanation of levels of tests: unit, interaction, integration and acceptance tests', 'DB Management > Cleanup > Cleanup before each test (known state)', 'DB Management > Preparation > setUp() & tearDown() methods']","['{0:For me unit tests should not deal with the database, integration tests deal with the database.}', '{1:Integration tests that deal with the database should in practice have a empty database with a tear up and tear down approach, using a transaction based approach is quite a good way to go (i.e. create a transaction on setup and rollback on tear down).}', ""{2:If your tests depend on the database, then I think it's more important that the data you care about is in a known state for your testing, rather than the database being empty.}""]"
32,Data-driven tests with jUnit,http://www.stackoverflow.com/questions/1822315,"['https://stackoverflow.com/a/1822573', 'https://stackoverflow.com/a/1822663', 'https://stackoverflow.com/a/1823134']","['Environment > In-Memory DB > Generic recommendation > Use in memory database', 'Environment > Tool > Mocking > Use Mockito', 'Test Code > API > Use parameterised tests']","['{0:JUnit4 you can use the Parameterized testrunner}', '{1:TestNG, with its @DataSource, shines.}', '{2:in-memory database such as hsqldb }', '{3:On top of that I will write my tests using JUnit and Mockito.}']"
33,Data Quality in Relational Database Regression Tests,https://softwareengineering.stackexchange.com/questions/162242,"['https://softwareengineering.stackexchange.com/a/162252', 'https://softwareengineering.stackexchange.com/a/162254']",['Structure/Design > Testability > Database design recommandation'],"['{0:database design.}', '{1:Validate that the program(s) }', '{2:database design validation}', '{3:guidelines on how/where to begin}']"
34,Determining the best way(s) of adding unit tests to a large project that makes good use of stored procedures,https://softwareengineering.stackexchange.com/questions/335295,['https://softwareengineering.stackexchange.com/a/335317'],"['Concepts > Definitions > Explanation of levels of tests: unit, interaction, integration and acceptance tests', 'DB Management > Cleanup > Transactions > Use transaction scopes (which revert the state of DB after each test)', 'Mocking > What > Mock stored procedure']","[""{0:his also means you don't need to mock the database (only the data), so writing the tests will be much easier.}"", ""{1:See if you can use transactions around each test. BEGIN the transaction before you start the test, and after the test ROLLBACK the transaction. That way you won't have to repopulate the database for each test - every test in the session will use the same initial database and the framework will clean up after it.}"", '{2:Unit tests that mocks the stored procedure and verifies the C# code uses it correctly.}']"
35,Different db for testing in Django?,http://www.stackoverflow.com/questions/4650509,"['https://stackoverflow.com/a/4650651', 'https://stackoverflow.com/a/48089700', 'https://stackoverflow.com/a/9797486']",['Environment > Configuration > Testing Framework > Django > Different settings for production and testing (staging) databases in Django'],['{0:In your settings.py (or local_settings.py)}']
36,Django: is there a way to count SQL queries from an unit test?,http://www.stackoverflow.com/questions/1254170,"['https://stackoverflow.com/a/1254615', 'https://stackoverflow.com/a/44370116', 'https://stackoverflow.com/a/7728720']",['IRRELEVANT ANSWER'],[None]
37,Does TDD include integration tests?,http://www.stackoverflow.com/questions/18988040,"['https://stackoverflow.com/a/18998744', 'https://stackoverflow.com/a/19000711', 'https://stackoverflow.com/a/19002069']","['Concepts > Book > Book recommendation', 'Concepts > Definitions > Explanation of levels of tests: unit, interaction, integration and acceptance tests', 'Concepts > Definitions > TDD has to be unit tests rather than integration tests', 'Mocking > When > Use Mocking', 'Process > Testing > Use integration testing']","['{0:Golden rule of TDD says: Never write new functionality without failing test.}', '{1:book Growing Object-Oriented Software, Guided by Tests }', '{2:From Test-Driven Development By Example }']"
38,Does using fixtures make a unit test an integration test?,https://softwareengineering.stackexchange.com/questions/367252,['https://softwareengineering.stackexchange.com/a/367257'],['Concepts > Definitions > No side effect and isolated = unit test'],"['{0:it has no side effects and can be run in parallel}', '{1:isolated}', '{2:then it’s a unit test}']"
