,title,url,answers,tags,highlights
72,How should I set up my integration tests to use a test database with Entity Framework?,http://www.stackoverflow.com/questions/13857180,"['https://stackoverflow.com/a/13857240', 'https://stackoverflow.com/a/13857281', 'https://stackoverflow.com/a/13951747']","['DB Management > Cleanup > Delete the database after all the tests', 'DB Management > Cleanup > Populate once and rollback changes after each test', 'DB Management > Cleanup > Transactions > Use transaction scopes (which revert the state of DB after each test)', 'DB Management > Preparation > setUp() & tearDown() methods', 'Environment > Configuration > General recommendation > Configuration recommendation', 'Structure/Design > Design Patterns > Have a base class for integration test fixtures']","['{0:The solution described below provides a new database for each run of the tests, and a separate transaction for each test.}', '{1:I created a base class for my integration tests, to provide setup and teardown.}', ""{2:Setup instantiates the context, creates the DB if it doesn't exist yet and starts a transaction. Teardown rolls back the transaction.}"", '{3:create the DB, once per test}', '{4:If you are using NUnit, you could use Setup/Teardown attribute with TransactionScope }', ""{5:I would recomend creating a base class DbItegrationTest for all your integration test fixtures so if you derive from this class all test methods won't do commits to database.}"", '{6:To configure Entity Framework for other database please override db connection string in your test assembly.}', '{7:ly, I have a class that takes care of deleting the database after all the tests have run:}']"
73,How to add rigor to my testing?,https://softwareengineering.stackexchange.com/questions/270422,"['https://softwareengineering.stackexchange.com/a/270564', 'https://softwareengineering.stackexchange.com/a/270630']","['Characteristics > Isolated/Independent > Unit test should be independent / isolated', 'Concepts > Coverage > 100% coverage is not possible', 'Concepts > Coverage > Cover critical execution paths', 'Concepts > Scope > Test it > Test pre- and postconditions', 'Environment > Use Real DB > Generic recommendation > Use real database']","['{0:a more grounded test and pragmatic approach is to execute all the critical/high value execution paths}', ""{1:identify and create a metrics (of criticality) for your end user's minimum required critical functionality set - invoke these functions/operations at (increasingly) much higher level than at a class level.}"", '{2:100% coverage is a very subjective term as you already know.}']"
74,How to automate integration testing?,http://www.stackoverflow.com/questions/516915,"['https://stackoverflow.com/a/516929', 'https://stackoverflow.com/a/516939', 'https://stackoverflow.com/a/521257']","['Characteristics > Paralysable > Unit tests should be runnable in parallel', 'DB Management > Test DB > Use embedded DB so tests can run in parallel', 'Environment > Tool > Generic recommendation > Various tool recommendations', 'Process > Automatization > Split integration tests into short-/long-running tests', 'Process > Testing > Run Integration tests after unit tests', 'Process > Testing > Run tests on checkin']","['{0:you want to catch mistake/bugs/test failures as soon as possible after they are introduced. Let that be your guide; everything else is technique}', '{1:Tests running in parallel.}', '{2:A life-cycle model where system/integration tests run only after unit tests have passed.}', '{3:the Continuous Integration and Testing Conference (CITCON) and/or the CITCON mailing list.}', '{4: CI and build|process automation tools out there.}', ""{5:I'd recommend using an embedded database engine which is recreated at least once before any run. This enables tests of different commits to work in parallel and provides a well defined starting point for the tests.}"", '{6: I\'ve also seen integration tests split into ""short-running"" integration tests and ""long-running"" integration tests}']"
75,How to automatically destroy django test database,http://www.stackoverflow.com/questions/12113050,['https://stackoverflow.com/a/12113633'],['Environment > Configuration > Testing Framework > Django > Django - Avoid creatinf database when it exists'],[None]
76,How to best create a test DB when doing TDD?,http://www.stackoverflow.com/questions/286876,"['https://stackoverflow.com/a/286942', 'https://stackoverflow.com/a/287019', 'https://stackoverflow.com/a/287117']","['Environment > Tool > Unit & Integration Testing > Use DBFit', 'Mocking > How > Use lists with LINQ to emulate db operations', 'Mocking > When > Use Mocking', 'Structure/Design > Design Patterns > Use dependency injection', 'Structure/Design > Design Patterns > Use template interfaces for all repositories, so the mock implements that interface', 'Test Code > Code example > Code example provided']","['{0:What practices do people do when they want to (stub?) fake out a persistence layer for quick and fast development? I use Dependency Injection to handle it and have some hard coded results for my persistence layer (which is really manual and boring).}', ""{1:use a list and LINQ to emulate a db's operations}"", '{2:_fakes.AsQueryable()}', ""{3:I assume you're creating a fakeRepository that is a concrete implementation of your IRepository which in turn is injected into your service layer.}"", '{4:I personally think its best to mock the database layer using a mocking framework.}', '{5:For these cases you can use a tool like DBFit to write tests for your database layer.}']"
77,How to create table during Django tests with managed = False,http://www.stackoverflow.com/questions/7020966,"['https://stackoverflow.com/a/49800437', 'https://stackoverflow.com/a/7021134', 'https://stackoverflow.com/a/7035002']","['DB Management > Preparation > Raw SQL to create tables in test set up', 'DB Management > Preparation > setUp() & tearDown() methods', 'Environment > Configuration > DB > Specific database configuration recommendation']",['{0:Execute raw SQL to create the table }']
78,How to create unit/integration tests for my web app?,https://softwareengineering.stackexchange.com/questions/214529,['https://softwareengineering.stackexchange.com/a/214536'],"['Concepts > Definitions > Explanation of levels of tests: unit, interaction, integration and acceptance tests', 'Concepts > Definitions > No side effect and isolated = unit test', 'Concepts > Definitions > Stubs vs Mocks', 'Mocking > How > Use stub and fake classes', 'Mocking > When > Use Mocking']","['{0:A unit test deals with a part of the code which is granular enough to be able to narrow the search of a bug if the unit test fails. There is no long polling here. No REST calls. No AJAX. No database access.}', '{1:Once you have unit tests covering the critical parts of the application, you can start assembling the parts. Interfaces between different components of a system are good places for mistakes, so the integration of components needs to be tested as well. This is what integration tests are about.}', '{2:eplace the database and provide sample products to use for testing purposes}', '{3:a mock which will ensure that it was indeed called by the tested unit and asked to decrease the quantity}']"
79,"How to create unit tests against non in-memory database such as MySQL in Play framework, with resetting to known state?",http://www.stackoverflow.com/questions/14750375,"['https://stackoverflow.com/a/15056473', 'https://stackoverflow.com/a/15137203', 'https://stackoverflow.com/a/22693381']","['DB Management > Cleanup > Use JUnit @Before to clean up DB before each test', 'DB Management > Connection > Hashmap to connect to the DB', 'DB Management > Test DB > Use the same RDBS for testing and production', 'Environment > Tool > Unit Testing > Use DbUnit', 'Environment > Use Real DB > Generic recommendation > Use real database', 'Test Code > Code example > Code example provided']","['{0:use the same RDBMS for testing}', ""{1:create a clean database and JUnit's @Before annotation}"", '{2:Ebean DdlGenerator to generate scripts to }', '{3:and dbunit for cleaning up before each test}', '{4:I simply created a HashMap to connect to the database,}']"
80,How to do database unit testing?,http://www.stackoverflow.com/questions/3772093,"['https://stackoverflow.com/a/3772165', 'https://stackoverflow.com/a/3772382', 'https://stackoverflow.com/a/45760681']","['Characteristics > Isolated/Independent > Keep tests independent', 'Concepts > Definitions > Feature tests', 'Concepts > Definitions > Maintaining test data', 'Concepts > Definitions > Managing schema', 'Concepts > Definitions > Schema tests', 'Concepts > Definitions > Security tests', 'Concepts > Definitions > Stock data tests', 'DB Management > Cleanup > Cleanup before each test (known state)', 'DB Management > Test DB > Separate Database for Testing', 'DB Management > Test DB > Use a test database with test data', 'Environment > In-Memory DB > Generic recommendation > Use in memory database', 'Environment > Tool > DB Migration > Use a database migration tool', 'Environment > Tool > Unit Testing > Use DbUnit', 'Process > Development > Allow concurrent work of developers']","['{0:The DbUnit framework (a testing framework allowing to put a database in a know state and to perform assertion against its content) has a page listing database testing best practices that, to my experience, are true.}', '{1:Prefer in memory database if possible (for speed)}', '{2:Use one schema per developer is a must (to allow concurrent work)}', '{3:Use a ""database migration"" tool (à la RoR) to manage schema changes and update a schema to the ultimate version}', '{4:Build or use a test harness allowing to put the database in a known state before each test and to perform asserts against the data after the execution (or to run tests inside a transaction that you rollback at the end of the test).}', '{5:Each tester needs a separate database}', '{6:have an easy way of creating a database to be tested}', '{7:Focus on specific areas and creating tests for a single module instead of covering all at once}', '{8:provide as many details as possible when a test fails}', '{9:Use one and the same test data for all tests}']"
81,How to handle unit tests with collaborators and side effects?,https://softwareengineering.stackexchange.com/questions/326001,['https://softwareengineering.stackexchange.com/a/326338'],"['Characteristics > Maintainable > Avoid brittle unit tests', 'Mocking > What > Mock the DAO not the db calls']","['{0:Another test fixture should be testing that}', '{1:unit testing}', '{2:This test is testing SomeServiceImpl, not SomeDao}']"
82,How to introduce testing in the development cycle,https://softwareengineering.stackexchange.com/questions/232236,['https://softwareengineering.stackexchange.com/a/232238'],"['Concepts > Definitions > Explanation of levels of tests: unit, interaction, integration and acceptance tests', 'Environment > In-Memory DB > Generic recommendation > Use in memory database', 'Environment > Tool > Generic recommendation > Use a testing framework', 'Mocking > When > Use Mocking']","['{0:testing frameworks}', '{1:use an in-memory database}']"
83,How to make Unit Tests to make sure stored procedure is deleting row from the database?,https://softwareengineering.stackexchange.com/questions/156428,"['https://softwareengineering.stackexchange.com/a/156430', 'https://softwareengineering.stackexchange.com/a/156431', 'https://softwareengineering.stackexchange.com/a/156432']","['Environment > Tool > Unit Testing > Use DbUnit', 'Mocking > When > Use Mocking', 'Test Code > Testing Stored Procedures > Test procedures in SQL']","['{0: integration test.}', '{1:like DBUnit in }', '{2:terfaces, mocks etc}', '{3:unit tests for SQL stored procedures}', '{4:mock the (abstracted) database}']"
84,How to migrate stored procedures to testing db?,http://www.stackoverflow.com/questions/4108533,"['https://stackoverflow.com/a/43945010', 'https://stackoverflow.com/a/5920249', 'https://stackoverflow.com/a/5982000']",['Environment > Configuration > Build Framework > Rake > Migration command'],[None]
85,How to mock controllers / rest endpoints for unit testing in Play Framework 2.x [Java],http://www.stackoverflow.com/questions/30030852,['https://stackoverflow.com/a/30049106'],"['Characteristics > Isolated/Independent > Avoid connecting to production db', 'Concepts > Definitions > Explanation of levels of tests: unit, interaction, integration and acceptance tests', 'Environment > In-Memory DB > Generic recommendation > Use in memory database', 'Mocking > When > Use Mocking']","['{0:not to test against production database.}', '{1:unit tests and integration tests.}', '{2:using a mock in memory database }', '{3:he production one but not the same database.}']"
86,How to organize unit/integration test in BDD,https://softwareengineering.stackexchange.com/questions/165623,"['https://softwareengineering.stackexchange.com/a/165639', 'https://softwareengineering.stackexchange.com/a/165640']","['DB Management > Connection > direct access to database for object creation', 'Process > Development > Acceptance Test Driven Development', 'Process > Development > Use Behavior-driven development (BDD)']","['{0:acceptance-test framework}', '{1:access the database directly}', '{2: BDD encourages a more behaviour-driven language for your tests. }']"
87,How to reduce the number of database connections in tests in PHPUnit and ZF3?,http://www.stackoverflow.com/questions/45651158,"['https://stackoverflow.com/a/45787565', 'https://stackoverflow.com/a/45792646', 'https://stackoverflow.com/a/45792864']","['DB Management > Connection > Create connection factory', ""DB Management > Connection > Don't do in set-up (it will connect once per test)"", 'DB Management > Connection > Pass connection as parameter', 'DB Management > Connection > Use persistent connections', 'DB Management > Test DB > Use a test database with test data', 'Environment > Use Real DB > SQLite > Faster tests > Use SQLite for faster tests', 'Environment > Use Real DB > SQLite > Faster tests > Use SQLite for integration tests', 'Structure/Design > Design Patterns > Use dependency injection']","['{0:SQLite}', '{1:PDO}', '{2:The DB connection should be either handled by DIC}', '{3:You can also prepare any number of test-databases }', '{4:Your tearDown() function suggests that your database connectivity is actually inside your setUp() function, which will connect it once per test.}', '{5:You can try putting it into your global bootstrap, so it connects once forever, a}']"
88,How to rollback a database transaction when testing services with Spring in JUnit?,http://www.stackoverflow.com/questions/4166983,"['https://stackoverflow.com/a/22979333', 'https://stackoverflow.com/a/4167050', 'https://stackoverflow.com/a/4167166']","['DB Management > Cleanup > Transactions > Use transaction scopes (which revert the state of DB after each test)', 'DB Management > Preparation > setUp() & tearDown() methods', 'Environment > Tool > Unit Testing > Use Spring Framework', 'Test Code > Code correction > Code correction']","['{0:You can do it by annotating your test method (or the whole test class) as @Transactional:}', '{1:Spring has some classes for testing that will wrap each test in a transaction,}', '{2:Add your code inside setUp() method, this will execute in start of the test and the last wrap up code should be put in teatDown() method that will executed at last. or you can also use @Before and @After annotation instead of it.}']"
89,How to rollback nested transactions with Propagation.REQUIRES_NEW in integration tests,http://www.stackoverflow.com/questions/5178708,"['https://stackoverflow.com/a/5179385', 'https://stackoverflow.com/a/8088462']",['DB Management > Cleanup > Transactions > Use transaction scopes (which revert the state of DB after each test)'],"['{0:want to rollback the transaction}', '{1:inner transaction is not rolledback in an exceptional scenario.}']"
90,How to run Django's test database only in memory?,http://www.stackoverflow.com/questions/3096148,"['https://stackoverflow.com/a/11018426', 'https://stackoverflow.com/a/3096410', 'https://stackoverflow.com/a/3098182']","['Environment > Configuration > Testing Framework > Django > Different settings for production and testing (staging) databases in Django', 'Environment > In-Memory DB > SQLIte (In-Memory) > Use SQLIte as in-memory DB', 'Test Code > Code correction > Code correction']",[None]
91,How to run django unit-tests on production database?,http://www.stackoverflow.com/questions/1646468,"['https://stackoverflow.com/a/1646530', 'https://stackoverflow.com/a/1648881', 'https://stackoverflow.com/a/24076857']","['Concepts > Definitions > There is no point in unit testing it', 'Concepts > Definitions > Treat like first-class production batch job', 'Environment > Configuration > Testing Framework > Django > Add this line of code', 'Test Code > Code example > Code example provided']","['{0:treated like a first-class production batch job.}', '{1: like a first-class production}', '{2:treated like a first-class production batch job}', '{3:here is the skeleton on how to perform unit tests on django production database.}']"
92,How to run tests sequentially in Xcode 6 beta3,http://www.stackoverflow.com/questions/24700153,"['https://stackoverflow.com/a/32601241', 'https://stackoverflow.com/a/45189206']","['DB Management > Cleanup > Cleanup before each test (known state)', 'DB Management > Preparation > setUp() & tearDown() methods', 'Test Code > Parallelisation > Queing (serializing) tests']","['{0:If you need your objects to have a consistent starting state for tests, I would recommend adding calls to the setUp method of your test classes. setUp called before each of the tests in a test class.}', '{1:but could you manage to put the tests into a serial queue? I}']"
93,How to seed database migrations for laravel tests?,http://www.stackoverflow.com/questions/42350138,"['https://stackoverflow.com/a/42350139', 'https://stackoverflow.com/a/49839397', 'https://stackoverflow.com/a/53752141']","['DB Management > Cleanup > Rollback the database after each test and migrate it before the next test', 'DB Management > Preparation > setUp() & tearDown() methods']",['{0:using the DatabaseMigrations trait for migrating and rolling back the database between tests}']
94,How to set up database-heavy unit tests in Symfony2 using PHPUnit?,http://www.stackoverflow.com/questions/10784973,"['https://stackoverflow.com/a/10787568', 'https://stackoverflow.com/a/12508889', 'https://stackoverflow.com/a/35463959']","['DB Management > Cleanup > Execute all tests against the test database (not only one and restore)', 'DB Management > Cleanup > Populate once and rollback changes after each test', 'DB Management > Cleanup > Recreate test db after each test run, if the test modified it', 'DB Management > Preparation > Use SQLite to copy and restore db file', 'DB Management > Preparation > Use test fixtures', 'Environment > Tool > DB Preparation > Doctrine Fixtures (Symfony)', 'Environment > Use Real DB > Generic recommendation > Use real database', 'Mocking > When > Use Mocking']","['{0:I use the doctrine/doctrine-fixtures-bundle for fixtures (no matter what purpose) and set up the whole database with all fixtures.}', '{1:recreate the database if a test changed it}', ""{2:I don't need to set up a database again if a test only reads but don't change anything}"", '{3:I use sqlite for testing because I can set up the database, then copy the sqlite file and replace it with a clean one to bring back the original database.}', '{4:I once read about a test setup where before you use the database you start a transaction (within the setUp method) and then use the tearDown to rollback.}', '{5:Unit testing only makes sense for services and not for repositories. And those services can use mocks of the entity manager.}']"
95,How to show SQL query log generated by a RSpec test?,http://www.stackoverflow.com/questions/6884408,"['https://stackoverflow.com/a/56293916', 'https://stackoverflow.com/a/6884418']",['Process > Test Failure Identification / Debugging > Use Active Record Explain to only log specific queries (Rails)'],"['{0:only log the queries you specify,}']"
96,How to simulate a DB for testing (Java)?,http://www.stackoverflow.com/questions/928760,"['https://stackoverflow.com/a/46206974', 'https://stackoverflow.com/a/928787', 'https://stackoverflow.com/a/929314']","['DB Management > Preparation > Each test should prepare its data', ""DB Management > Test DB > Don't use different type of DB than in production"", 'Environment > Configuration > DB > Tune DB config for testing', 'Environment > Tool > DB Migration > Use flyway/liquibase', 'Environment > Tool > Integration Testing > Use testegration', 'Environment > Tool > Unit Testing > Use DbUnit', 'Environment > Tool > Virtualization > Use Docker', 'Environment > Tool > Virtualization > Use testcontainer', 'Environment > Use Real DB > Generic recommendation > Avoid memory DB: not fully compatible, no full reliability', ""Mocking > When > Don't mock connection"", 'Performance > General improvement > Use tmpfs', 'Process > Automatization > Automate upgrades in database structures', 'Process > Testing > Seperate unit and integration testing']","['{0:it is important for me to be able to test my DB usage easily}', '{10:write your application with a good separation of db and non-db related logic,}', '{11:have groups of tests and keep db tests turned off by default }', '{12:prepare one dataset for your all test cases. then you have to maintain it and reason about it.}', '{13:each tests prepares its data. }', '{14:the main principle is to check if your software generates desired output in response to specific input.}', '{15:you can call commit/drop cache in between.}', '{16:sometimes you want to test your implementation instead of the contract and then you check if your dao changed the state of the db.}', ""{17:you'll always have the problem 'who will test my tests', and the answer is: no one, so keep them simple!}"", '{18:Separate out the Database accessing logic and functions from general business logic and hide it behind an interface.}', '{19:Treat tests for the database as integration tests that are separated from the main body of unit tests and need to run on a setup database}', ""{1:I don't like DBs when it comes to tests }"", '{20:Every developer will need their own distinct database.}', '{21:Use a tool like http://www.liquibase.org to manage upgrades in your databases structure.}', '{22:Use a tool like http://dbunit.sourceforge.net/ to manage the data.}', '{23:You need functional tests which also have DBUnit like scenario data, but this are far larger sets of data and execute the entire system. }', '{2:I would advise against using a different type of DB than what you use in production unless you go through an ORM layer.}', ""{3:you mock your repositiories and you don't test them or you use the same db in your tests and you test your sqls. }"", ""{4:memory dbs are not fully compatible so they won't give you full coverage and reliability}"", '{5:never ever try to mock/simulate the deep db objects like connection, result set etc.}', '{6:now we have docker and there are images for almost every db}', '{7:what takes time is the application startup. there are plenty of ways to speed this up}', '{8:each db have plenty of tuning options that makes it less durable and much faster. }', '{9:you can also put the entire db into tmpfs}']"
97,How to suppress InMemoryEventId.TransactionIgnoredWarning when unit testing with in-memory database with transactions?,http://www.stackoverflow.com/questions/44080733,"['https://stackoverflow.com/a/44080734', 'https://stackoverflow.com/a/48342515']",['Environment > In-Memory DB > Generic recommendation > Specific in memory database recommandation'],[None]
98,How to test an Oracle Stored Procedure with RefCursor return type?,http://www.stackoverflow.com/questions/6781916,"['https://stackoverflow.com/a/11581663', 'https://stackoverflow.com/a/6782008', 'https://stackoverflow.com/a/6782009']","['Process > Test Failure Identification / Debugging > SQLDeveloper Run/PL/SQL Window', 'Test Code > Code example > Code example provided', 'Test Code > Code example > Test Examples']","[""{0:The 'Run PL/SQL' window will let you edit the PL/SQL Block}""]"
99,How to test an SQL Update statement before running it?,http://www.stackoverflow.com/questions/11011384,"['https://stackoverflow.com/a/11011416', 'https://stackoverflow.com/a/11011447', 'https://stackoverflow.com/a/31441731']","['DB Management > Cleanup > Transactions > Run queries in transaction', 'Environment > Configuration > DB > Turn off MySQL ""autocommit""']",[None]
100,How to test DAO methods using Mockito?,http://www.stackoverflow.com/questions/28388204,"['https://stackoverflow.com/a/28388285', 'https://stackoverflow.com/a/28390472', 'https://stackoverflow.com/a/28396192']","['Environment > Tool > Mocking > Use Mockito', 'Environment > Use Real DB > Generic recommendation > Use real database', 'Mocking > When > Use Mocking', 'Test Code > Code example > Code example provided']","['{0:you need an actual database}', '{1:how you should test it:}', '{2:using Mockito to tes}', '{3:Mockito}']"
101,How to test database connectivity in python?,http://www.stackoverflow.com/questions/11735371,"['https://stackoverflow.com/a/11735559', 'https://stackoverflow.com/a/11896088']",['IRRELEVANT ANSWER'],[None]
