,title,url,answers,tags,highlights
140,Maven Failsafe Plugin: how to use the pre- and post-integration-test phases,http://www.stackoverflow.com/questions/19816407,['https://stackoverflow.com/a/19824303'],"['Environment > Configuration > Build Framework > Maven > Maven lifecycles', 'Environment > Configuration > Build Framework > Maven > SQL Maven plugin']","['{0:bind a maven plugin doing that job to these phas}', '{1:that}']"
141,Mockito to test void methods,http://www.stackoverflow.com/questions/5249920,"['https://stackoverflow.com/a/5250533', 'https://stackoverflow.com/a/5251914']","['Mocking > How > Custom mocking code without framework', 'Test Code > API > Use a callback mathod, executed every time the test code executes a given mock (Mockito)', 'Test Code > Code example > Code example provided']","['{0:callback method that i}', '{1:given mock.}', '{2:made a custom implementation}']"
142,My first model test in PHPUnit,https://codereview.stackexchange.com/questions/59662,"['https://codereview.stackexchange.com/a/59679', 'https://codereview.stackexchange.com/a/59693']","['Characteristics > Up-to-date > Keep test DB in sync with production DB to avoid testing stale/outdated data', 'Concepts > Definitions > Explanation of levels of tests: unit, interaction, integration and acceptance tests', 'Concepts > Scope > Test it > Test failing calls (code behaves as expected in case smething goes wrong)', 'DB Management > Test data > Generation > Generate during the build process', 'DB Management > Test data > Storage > Do not mix test data with testing code', 'Environment > Tool > Integration Testing > Codeception', 'Environment > Tool > Unit Testing > Use PHPUnit', 'Structure/Design > Design Patterns > Have a base class for integration test fixtures', 'Structure/Design > Testability > Design with single responsibility']","['{0:PHPUnit_Extensions_Database_TestCase}', '{10:you can use PHPUnit }', '{11:use Codeception (thanks to @EliasVanOotegem for the suggestion) to run integration tests}', '{1:test data}', ""{2:it shouldn't be mixed in with the testing code}"", '{3:Single Responsability Principle}', '{4:dd tests to make sure your code behaves as expected in case something goes wrong}', '{5:Use it, to create an abstract base test-case class. This abstract test class should handle the connection stuff, and enforce all the child classes to load actual fixtures.}', '{6:The test data can be generated during the build process}', ""{7:check all possible scenario's concerning new inserts and updates. All possible scenario's.}"", '{8:All changes to the actual DB have to be applied to your test DB}', '{9:The definition of a unit test by Michael Feathers helps drawing the line.}']"
143,MySQL - force not to use cache for testing speed of query,http://www.stackoverflow.com/questions/181894,"['https://stackoverflow.com/a/181905', 'https://stackoverflow.com/a/6408485', 'https://stackoverflow.com/a/6706731']","['DB Management > Cleanup > Disable caching between queries', 'Environment > Configuration > DB > Use MySQL ""sql_no_cache""', 'Test Code > Code example > Database test script']","['{0:the SQL_NO_CACHE }', '{1:connection:}', '{2:query cache}']"
144,"Never written much unit tests, how can I practice more of it?",https://softwareengineering.stackexchange.com/questions/128859,"['https://softwareengineering.stackexchange.com/a/128862', 'https://softwareengineering.stackexchange.com/a/128865', 'https://softwareengineering.stackexchange.com/a/317706']","['Concepts > Book > Book recommendation', 'Concepts > Definitions > Explanation of levels of tests: unit, interaction, integration and acceptance tests', 'Process > Testing > Practice writing unit tests']","['{0:practice is to just do i}', '{1:class and write unit tests for it}', '{2:Writing tests for code which accepts data from the web.}', '{3:with The Art of Unit Testing)}']"
145,"Node.JS testing with Jasmine, databases, and pre-existing code",https://softwareengineering.stackexchange.com/questions/133086,['https://softwareengineering.stackexchange.com/a/133102'],"['Concepts > Scope > Test it > One test for each type of output resultset (one row, multiple rows, empty resultset)', 'Mocking > When > Use Mocking']","['{0:a test for every type of thing that the database can return}', '{1:Mock out a different type of return}']"
146,PDO Connection Test,http://www.stackoverflow.com/questions/6263443,"['https://stackoverflow.com/a/23288361', 'https://stackoverflow.com/a/6263868', 'https://stackoverflow.com/a/6263970']","['DB Management > Connection > Set time out conenction limit', 'Structure/Design > Design Patterns > PDO (PHP Data Objects) best practice', 'Test Code > API > Exception Handling >  Set error mode to exception mode (PHP PDO)']","['{0:you should set error mode to exception mode}', '{1:you should also set up PDO::ATTR_TIMEOUT }']"
147,Pentaho kettle: how to set up tests for transformations/jobs?,http://www.stackoverflow.com/questions/9993611,"['https://stackoverflow.com/a/15837725', 'https://stackoverflow.com/a/31414165', 'https://stackoverflow.com/a/9996382']",['Environment > Configuration > General recommendation > Configuration recommendation'],[None]
148,Performance test sql queries,http://www.stackoverflow.com/questions/6846776,['https://stackoverflow.com/a/6918993'],['Performance > Benchmarking > Run awrgrpt.sql (Oracle)'],['{0:running the awrgrpt.sql }']
149,Philisophical Questions about Test-Driven Development,http://www.stackoverflow.com/questions/1447474,"['https://stackoverflow.com/a/1447497', 'https://stackoverflow.com/a/1450441', 'https://stackoverflow.com/a/1450533']","['DB Management > Test DB > Separate Database for Testing', 'Environment > Tool > Mocking > Typemock', 'Environment > Use Real DB > Generic recommendation > Use real database', 'Performance > General improvement > Use ORM to support a light testing dbms', 'Process > Testing > Best option is state based tests', 'Structure/Design > Coupling > Design with loose coupling', 'Structure/Design > Design Patterns > MVP (Model-View-Presenter)', 'Structure/Design > Design Patterns > Use dependency injection']","['{0:The best option are state-based tests: setup fixture, call system under test, check state of system under test and pure functional (as in functional programming) tests: call with x returns a.}', '{1:Try to design your system in a way that most of its functionality is loosely coupled.}', ""{2:If you try to test your system with integration tests you'll enter into the permutation casino.}"", ""{3:You cannot mock a database, unless you're going to reimplement the behavior of every database you would like to support.}"", ""{4:I don't use mock for my unit test. Instead, I run the tests on a real database}"", '{5:For NHibernate applications, I maintain two databases with same schema, but different database type (ORM makes this easy). I use sqlite for my automated testing, and a real MySQL or SQL server database for ad-hoc testing.}', '{6: Typemock r}', '{7:use the MVP pattern to separate out the Model, View and Presenter}', '{8:( or dependency injection)}']"
150,Phpunit testing with database,http://www.stackoverflow.com/questions/4585345,"['https://stackoverflow.com/a/4585498', 'https://stackoverflow.com/a/4585530', 'https://stackoverflow.com/a/4585539']","['Concepts > Definitions > Explanation of levels of tests: unit, interaction, integration and acceptance tests', 'DB Management > Cleanup > Cleanup before each test (known state)', 'DB Management > Cleanup > Populate once and rollback changes after each test', 'DB Management > Cleanup > Transactions > Use transaction scopes (which revert the state of DB after each test)', 'DB Management > Preparation > setUp() & tearDown() methods', 'DB Management > Test DB > Use a test database with test data', 'Environment > Tool > Unit Testing > Use DbUnit', 'Environment > Use Real DB > Generic recommendation > Use real database', 'Mocking > When > Replace the DB with a mock object', 'Structure/Design > Design Patterns > Use dependency injection']","['{0:Mock away the Database class and return fake data}', '{1:Using setUp() and tearDown() to get a consistent state for your data before running your tests is (imho) a fine way to write db-driven unittests. }', '{2:look into the DbUnit extension }', '{3:db-unittesting in Sebastian Bergmanns phpqa book.}', '{4:Could your application allow for a custom database name and automated setup of all tables it may also be possible to set the db up once with a lot of testdata and use that data in all your tests}', '{5:be careful not to do what github did.}', '{6:you can wrap test in a transaction and roll it back after the test}', ""{7:you can't test code that uses transactions}""]"
151,Python simple Class with sqlite and unit testing,https://codereview.stackexchange.com/questions/185051,['https://codereview.stackexchange.com/a/185054'],"['Concepts > Definitions > Explanation of levels of tests: unit, interaction, integration and acceptance tests', 'DB Management > Connection > The caller should handle the connection']",[None]
152,Rails 3.0.7 -&gt; How do you get your tests to run faster?,http://www.stackoverflow.com/questions/6087329,"['https://stackoverflow.com/a/6087475', 'https://stackoverflow.com/a/6087816', 'https://stackoverflow.com/a/6133078']","['Environment > Configuration > App Framework > Ruby > Clean Gemfiles', ""Environment > Tool > Test Data Generation > Rails' Factory Girl"", 'Environment > Tool > Testing Framework > DB Plugin > Use Spork', 'Mocking > How > Use stub and fake classes', 'Mocking > When > Use Mocking', 'Performance > General improvement > Deferring garbage collection']","['{0:Spork will do all the bootstrapping and environment requires once}', '{1:Clean up your Gemfile}', ""{2:You'll need to have nearly all ActiveRecord functionality stubbed out in your tests, but if you can do this, you'll see a massive decrease in your test tim}"", '{3:Factory Girl }']"
153,Rails 4: How to reset test database?,http://www.stackoverflow.com/questions/25877734,"['https://stackoverflow.com/a/25878014', 'https://stackoverflow.com/a/30615283', 'https://stackoverflow.com/a/51506710']","['Environment > Configuration > Build Framework > Rake > Database Cleanup command', 'Environment > Tool > DB Cleanup > DatabaseCleaner (Ruby)']",['{0:In lieu of using the DatabaseCleaner gem}']
154,Rails –Testing named scopes: test scope results or scope configuration?,http://www.stackoverflow.com/questions/22902666,['https://stackoverflow.com/a/22921819'],"['Concepts > Scope > Test it > Test query correctness', 'DB Management > Test DB > Use local database']","['{0:If, on the other hand, your scope (or any query) is compound, or uses advanced features in a complex configuration, I believe that setting up tests that assert its behavior, by using a real live database (which is installed locally, with a small custom-tailored data set) can go a long way in assuring you that your code works.}']"
155,Rake db:test:prepare does not create `table view`,http://www.stackoverflow.com/questions/37954164,['https://stackoverflow.com/a/57152488'],"['Environment > Configuration > DB > Specific database configuration recommendation', 'Environment > Tool > DB Migration > Configure views > Scenic']",[None]
156,Removing the &quot;integration test scam&quot; - Understanding collaboration and contract tests,https://softwareengineering.stackexchange.com/questions/135011,['https://softwareengineering.stackexchange.com/a/135012'],['Concepts > Book > Book recommendation'],"[""{0:I've recently watched Integration Tests are a Scam by J. B. Rainsberger }"", '{1:I can recommend two excellent books:}']"
157,Repository and Controller tests,https://codereview.stackexchange.com/questions/59537,"['https://codereview.stackexchange.com/a/59540', 'https://codereview.stackexchange.com/a/59854']","['Mocking > When > Mock commands, not queries', 'Structure/Design > Design Patterns > Consider Data builder pattern', 'Structure/Design > Testability > Data object should focus on holding data, not functionality', 'Test Code > Code example > Code example provided']","['{0:Mock commands, not queries}', '{1:Data builder patter}', '{2:holding data than functionality}']"
158,Running migrations against the Rails test environment,http://www.stackoverflow.com/questions/5340635,['https://stackoverflow.com/a/5340661'],['Environment > Configuration > Build Framework > Rake > Migration command'],[None]
159,Should each unit test be able to be run independently of other tests?,https://softwareengineering.stackexchange.com/questions/64306,"['https://softwareengineering.stackexchange.com/a/64308', 'https://softwareengineering.stackexchange.com/a/64314', 'https://softwareengineering.stackexchange.com/a/64315']","['Characteristics > Isolated/Independent > Unit test should be independent / isolated', 'Concepts > Definitions > Explanation of levels of tests: unit, interaction, integration and acceptance tests', 'Process > Testing > Use integration testing']","['{0:can not run independently then they are not unit tests}', '{1:not rely on any external state}', '{2:unit of code in isolation}', '{3: integration testing}', '{4: method would be isolated and tested independently,}', '{5:each test the ability to stand alone}']"
160,Should I Unit Test Data Access Layer? Is this a good practice and how to do it?,http://www.stackoverflow.com/questions/3333120,"['https://stackoverflow.com/a/3333179', 'https://stackoverflow.com/a/3333220', 'https://stackoverflow.com/a/3333250']","[""Characteristics > Isolated/Independent > Unit tests shoudn't touch an actual database"", 'Concepts > Definitions > Integration tests involves real database', ""Concepts > Scope > Don't test it > Don't test it if there is no logic there"", 'Environment > Use Real DB > Generic recommendation > Use real database']","[""{0:sure your unit tests don't touch an actual database}"", '{1:only test code which has conditional logic (IF statements etc)}', '{2:running tests on the real db is a good idea, you might ruin important data}', '{3:Is it better to have test database, or create database data during test?}']"
161,Shouldn't unit tests use my own methods?,https://softwareengineering.stackexchange.com/questions/330304,"['https://softwareengineering.stackexchange.com/a/330314', 'https://softwareengineering.stackexchange.com/a/330317', 'https://softwareengineering.stackexchange.com/a/330319']","['Concepts > Definitions > Explanation of levels of tests: unit, interaction, integration and acceptance tests', 'Mocking > When > Use Mocking']","['{0:unit tests is to isolate code}', '{1:and by definition }', '{2:Unique tests that perform in isolation are an absolute must}', '{3:tests that cross units.}', '{4:This one of the many reasons why mocking frameworks like Mockito are so popular }']"
162,Should persistence tests depend on the data access layer implementation?,https://softwareengineering.stackexchange.com/questions/359038,['https://softwareengineering.stackexchange.com/a/359044'],['Mocking > When > Use Mocking'],[None]
163,Should service test classes connect to the database,https://softwareengineering.stackexchange.com/questions/119367,"['https://softwareengineering.stackexchange.com/a/119368', 'https://softwareengineering.stackexchange.com/a/119372']","['Environment > In-Memory DB > Generic recommendation > Use in memory database', 'Environment > In-Memory DB > SQLIte (In-Memory) > Use SQLIte as in-memory DB', 'Mocking > What > Mock the DAO not the db calls']","[""{0:Your test classes shouldn't connect to the database if you are testing only the business logic, you should use mocks instead.}"", ""{1: I've seen some DAO objects unit test using in memory database such as SQLite.}""]"
164,Should you hard code your data across all unit tests?,https://softwareengineering.stackexchange.com/questions/212678,"['https://softwareengineering.stackexchange.com/a/212689', 'https://softwareengineering.stackexchange.com/a/212691', 'https://softwareengineering.stackexchange.com/a/212702']","['Characteristics > Isolated/Independent > Unit test should be independent / isolated', 'Characteristics > Self-explaining > Assumptions on existings records should be obvious', 'Concepts > Definitions > Explanation of levels of tests: unit, interaction, integration and acceptance tests', 'DB Management > Cleanup > Cleanup before each test (known state)', 'DB Management > Preparation > Use test fixtures', 'DB Management > Test data > Usage > Keep irrelevant data out of the test', 'Mocking > What > Mock the DAO not the db calls']","['{0:everything should be tested in isolation}', '{1:Your DTO/entity type classes can be the real thing, but if classes are performing operations you need to be mocking them}', '{2:At the start of the test, everything is created, at the end of the test everything is destroyed.}', ""{3:If the data is part of the test (eg. Should not print rows with a state of 7) then code it in the test, so that it's clear what the author intended to happen.}"", '{4:a test class that keeps irrelevant data out of the test}']"
165,Simple and reliable in memory database for fast java integration tests with support for JPA,http://www.stackoverflow.com/questions/3444265,"['https://stackoverflow.com/a/3444283', 'https://stackoverflow.com/a/3444790', 'https://stackoverflow.com/a/7303750']","['Environment > In-Memory DB > Derby > Use Apache Derby', 'Environment > In-Memory DB > H2 > H2', 'Environment > In-Memory DB > HSQLDB > HSQLDB']","['{0:I now use H2 }', ""{1:I've been using HSQLDB in-memory }"", '{2:Derby supports an in-memory mode}']"
166,Simple embedded Kafka test example with spring boot,http://www.stackoverflow.com/questions/48753051,"['https://stackoverflow.com/a/48756251', 'https://stackoverflow.com/a/48789198', 'https://stackoverflow.com/a/56900462']",['Environment > Configuration > General recommendation > Recommend specific library/configuration'],[None]
167,Simple Repository Pattern without ORM and Unit Tests,https://codereview.stackexchange.com/questions/132541,"['https://codereview.stackexchange.com/a/132671', 'https://codereview.stackexchange.com/a/132724']","['Concepts > Definitions > Unit tests are incomplete', 'Structure/Design > Testability > Design with single responsibility', 'Test Code > Code example > Code example provided']","['{0:unit tests feel a bit incomplete}', '{1:a look at }']"
168,Simple REST Base Web Server with Unit Tests,https://codereview.stackexchange.com/questions/220684,[None],['NO ANSWER'],[None]
169,Spring/Hibernate/Junit example of testing DAO against HSQLDB,http://www.stackoverflow.com/questions/2861796,"['https://stackoverflow.com/a/2862836', 'https://stackoverflow.com/a/2862887', 'https://stackoverflow.com/a/6088175']","['Test Code > API > Spring Framework > Use JDBC Namespace', 'Test Code > API > Spring Framework > Use TestContext', 'Test Code > Code example > Code example provided']","['{0:new jdbc namespace }', '{1:HSQLDB.}', '{2:JPA or Hibernate }', '{3:using Hibernate,}', '{4:Spring}', '{5:HSQLDB}', ""{6:use Spring's TestContext Framework}""]"
170,Spring test injection not working when using TestExecutionListener,http://www.stackoverflow.com/questions/15704091,"['https://stackoverflow.com/a/15704700', 'https://stackoverflow.com/a/41538935']","['Test Code > API > Use specific API', 'Test Code > Code example > Code example provided']",['{0: I just added the DependencyInjectionTestExecutionListener explicitly with my custom one and everything works fine}']
171,SQLCop tests for tSQLt,http://www.stackoverflow.com/questions/9898865,"['https://stackoverflow.com/a/9907724', 'https://stackoverflow.com/a/9907939']",['Environment > Tool > Static Analysis > SQLCop'],"['{0:SQLCop.}', '{1:SQLCop-type tests }']"
172,SQL Injection Detection - Have compiled regexes... looking for test injections,http://www.stackoverflow.com/questions/6174691,['https://stackoverflow.com/a/6177137'],['Environment > Tool > Vulnerability Testing > Check PHP-IDS'],['{0:You might want to check out the PHPIDS}']
173,SQLite Database inserting + Unit tests in Java,https://codereview.stackexchange.com/questions/132742,['https://codereview.stackexchange.com/a/186862'],"['Concepts > Coverage > Cover all corners', 'Concepts > Coverage > Test border cases', 'DB Management > Preparation > setUp() & tearDown() methods']","['{0:For unit testing, you should reach good coverage. Writing unit tests for every possible scenario for a particular class.}']"
174,Stored procedures and unit testing,http://www.stackoverflow.com/questions/7664270,"['https://stackoverflow.com/a/16180585', 'https://stackoverflow.com/a/7702298']","['Environment > Tool > Unit Testing > MyTAP', 'Environment > Tool > Unit Testing > STK/Unit']","['{0:MyTAP}', '{1:STK/Unit}', '{2:unit testing framework}']"
175,TDD and test automation in applications heavily dependent on databases and user input,https://softwareengineering.stackexchange.com/questions/180978,['https://softwareengineering.stackexchange.com/a/180979'],"['Concepts > Definitions > Explanation of levels of tests: unit, interaction, integration and acceptance tests', 'Environment > Tool > Unit Testing > Use PHPUnit', 'Mocking > When > Use Mocking']","['{0:PHPUnit}', '{1:unit tests to test the singularity of their business rules}', '{2:mock the database, or write functional or integration tests}']"
176,TDD: &quot;Test Only&quot; Methods,http://www.stackoverflow.com/questions/2295965,"['https://stackoverflow.com/a/2296016', 'https://stackoverflow.com/a/2296037', 'https://stackoverflow.com/a/2296042']","['Structure/Design > Coupling > Create a separate package', 'Structure/Design > Testability > Follow the Open/Closed principle', 'Test Code > API > Implement test-specific API in a subclass']","['{0: you can follow the Open/Closed Principle and open up your API so that others would be able to add the desired functionality.}', '{1: if I have a DataLayer class which has all the public methods to access the data layer, then I might subclass it with a Test_DataLayer subclass}']"
177,Test arrangement using the system under test,https://softwareengineering.stackexchange.com/questions/319159,"['https://softwareengineering.stackexchange.com/a/319160', 'https://softwareengineering.stackexchange.com/a/319162']","['Structure/Design > Testability > Refactoring to reduce coupling', 'Test Code > Re-use production code > Use production code in tests']","[""{0:there's an opportunity to refactor things in a way that would make both the tests and the production code easier to write}"", ""{1:it's perfectly fine for none of the tests to call it in isolation}"", '{2:ok to use production code for your tests}']"
178,Test connection to database C#,https://codereview.stackexchange.com/questions/5930,"['https://codereview.stackexchange.com/a/5931', 'https://codereview.stackexchange.com/a/5932', 'https://codereview.stackexchange.com/a/5933']",['Test Code > Code example > Code example provided'],[None]
179,testing admin.ModelAdmin in django,http://www.stackoverflow.com/questions/6498488,"['https://stackoverflow.com/a/21919959', 'https://stackoverflow.com/a/54667823', 'https://stackoverflow.com/a/6498681']",['IRRELEVANT ANSWER'],[None]
180,"Testing a service that makes database calls, without a database",https://codereview.stackexchange.com/questions/208871,['https://codereview.stackexchange.com/a/208877'],['IRRELEVANT ANSWER'],"['{0:each one calls a different stored procedure in the database}', '{1:You could instead use something like assertSame(voMock, voResult) to ensure that the instance returned by the service method is the same one that is returned by the *Proc method.}']"
181,Testing controller class using mockito mvc,https://codereview.stackexchange.com/questions/142896,['https://codereview.stackexchange.com/a/142944'],"['Characteristics > Small > Make small tests', 'Environment > In-Memory DB > Generic recommendation > Use in memory database', 'Environment > In-Memory DB > H2 > H2']",[None]
182,"Testing database insertion, removal, and modification from program code (i.e., rather than test code)",https://softwareengineering.stackexchange.com/questions/384724,"['https://softwareengineering.stackexchange.com/a/384736', 'https://softwareengineering.stackexchange.com/a/384737', 'https://softwareengineering.stackexchange.com/a/384740']","['Concepts > Coverage > 100% coverage is not possible', 'Concepts > Coverage > Aim at 100% of the DAO layer', 'Concepts > Definitions > Explanation of levels of tests: unit, interaction, integration and acceptance tests', ""Concepts > Scope > Don't test it > Don't test 3rd party code"", 'DB Management > Cleanup > Transactions > Use transaction scopes (which revert the state of DB after each test)', 'DB Management > Test DB > Use a Test database and rollback', 'Environment > In-Memory DB > Derby > Use Apache Derby', 'Environment > In-Memory DB > H2 > H2', 'Process > Continuous Integration > Rebuild a dedicated test DB for every build', 'Process > Development > Use Behavior-driven development (BDD)']","['{0:DAO tests run everything in a self-rolling-back transaction (some frameworks make this easier than others)}', '{1:100% test coverage of data access layer}', '{2:CI pipeline drops and rebuilds a dedicated test database for every build}', '{3:I am not advocating for 100% test coverage in general.}', '{4:applications that use Oracle or DB2 have database access tests that run against in memory databases like H2 or Apache Derby.}', '{5:Some testing approaches like BDD even encourage end to end tests as the primary testing method.}', '{6:Avoid tests that verify that a third party component works correctly}', '{7:You can configure the database with in-memory storage.}']"
